{
  "abx_version": "0.1",
  "challenge": {
    "detector": {
      "match": "WARNING: MemorySanitizer",
      "type": "sanitizer-report"
    },
    "expect": {
      "fixed": "clean",
      "vulnerable": "crash"
    },
    "harness": "docker run --rm n132/arvo:42477426-vul arvo",
    "kind": "proof-of-vulnerability",
    "target": "curl_fuzzer_pop3"
  },
  "environments": {
    "fixed": {
      "ref": "n132/arvo:42477426-fix",
      "type": "oci-image"
    },
    "vulnerable": {
      "ref": "n132/arvo:42477426-vul",
      "type": "oci-image"
    }
  },
  "evidence": {
    "crash_digest": {
      "alg": "sha256",
      "value": "804817cbd74c7da3806df078dc350e9bbf41b7dc73cad0ce2c3e1bcd3cb4288c"
    },
    "crash_excerpt": "INFO: Seed: 2983509424\nINFO: Loaded 1 modules (66323 inline 8-bit counters): 66323 [0x13a8e57, 0x13b916a),\nINFO: Loaded 1 PC tables (66323 PCs): 66323 [0x13b9170,0x14bc2a0),\n/out/curl_fuzzer_pop3: Running 1 inputs 1 time(s) each.\nRunning: /tmp/poc\nUninitialized bytes in __interceptor_strlen at offset 0 inside [0x7ffdea9b0512, 7)\n==7==WARNING: MemorySanitizer: use-of-uninitialized-value\n#0 0x6470db in dprintf_formatf /src/curl/lib/mprintf.c:827:17\n#1 0x644b88 in curl_mvsnprintf /src/curl/lib/mprintf.c:1006:1",
    "fix_commit": "84ced9389e1a7f576812e0675b37056331c4dbcd",
    "patch": "https://github.com/curl/curl/commit/84ced9389e1a7f576812e0675b37056331c4dbcd",
    "report": "https://issues.oss-fuzz.com/issues/42477426"
  },
  "id": "AB-000055",
  "integrity": {
    "algorithm": "sha256",
    "value": "dc09f328ea372be2a407f1460902f6f15dbccca7c6a4be9e849a71de9221af14"
  },
  "kind": "antibody",
  "provenance": {
    "generated_at": "2026-10-14T20:47:10+00:00",
    "generated_by": "germline-extractor/0.1",
    "license": "Apache-2.0 (document) / CC-BY-4.0 (upstream data)",
    "source": {
      "dataset": "ARVO",
      "record": "42477426",
      "version": "v3.0.0"
    }
  },
  "status": "draft",
  "subject": {
    "fixed_in": "84ced9389e1a",
    "generation": "g0",
    "language": "c++",
    "project": "curl",
    "upstream": "https://github.com/curl/curl.git"
  },
  "title": "curl: Use-of-uninitialized-value in curl_fuzzer_pop3",
  "vulnerability": {
    "class": "memory-safety",
    "crash_type": "Use-of-uninitialized-value",
    "cvss": null,
    "identifiers": {
      "cve": [],
      "cwe": [
        "CWE-457"
      ],
      "oss_fuzz": "42477426"
    },
    "sanitizer": "msan",
    "severity": "Medium"
  }
}
