{
  "abx_version": "0.1",
  "challenge": {
    "detector": {
      "match": "ERROR: AddressSanitizer",
      "type": "sanitizer-report"
    },
    "expect": {
      "fixed": "clean",
      "vulnerable": "crash"
    },
    "harness": "docker run --rm n132/arvo:42470801-vul arvo",
    "kind": "proof-of-vulnerability",
    "target": "ffmpeg_AV_CODEC_ID_LIBFDK_AAC_fuzzer"
  },
  "environments": {
    "fixed": {
      "ref": "n132/arvo:42470801-fix",
      "type": "oci-image"
    },
    "vulnerable": {
      "ref": "n132/arvo:42470801-vul",
      "type": "oci-image"
    }
  },
  "evidence": {
    "crash_digest": {
      "alg": "sha256",
      "value": "411aef7f3c043e59ff8a7859c487f228ed3dd692542a3c44da513c775045e77f"
    },
    "crash_excerpt": "INFO: Seed: 3950785085\nINFO: Loaded 1 modules (51581 inline 8-bit counters): 51581 [0x11b14c8, 0x11bde45),\nINFO: Loaded 1 PC tables (51581 PCs): 51581 [0xdab8e0,0xe750b0),\n/out/ffmpeg_AV_CODEC_ID_LIBFDK_AAC_fuzzer: Running 1 inputs 1 time(s) each.\nRunning: /tmp/poc\n=================================================================\n==7==ERROR: AddressSanitizer: global-buffer-overflow on address 0x000000d6e1b4 at pc 0x000000aa8990 bp 0x7fffb9e15490 sp 0x7fffb9e15488\nREAD of size 4 at 0x000000d6e1b4 thread T0\nS",
    "fix_commit": "85a921f46184dace4b4f3d968830991eff218e3f",
    "patch": "https://git.ffmpeg.org/gitweb/ffmpeg.git/commitdiff/85a921f46184dace4b4f3d968830991eff218e3f",
    "report": "https://issues.oss-fuzz.com/issues/42470801"
  },
  "id": "AB-000019",
  "integrity": {
    "algorithm": "sha256",
    "value": "d66f0f1329677aa9f2d547de386dea88b5df3ec98d4c5ec2916abd752d319bb8"
  },
  "kind": "antibody",
  "provenance": {
    "generated_at": "2026-10-14T20:47:10+00:00",
    "generated_by": "germline-extractor/0.1",
    "license": "Apache-2.0 (document) / CC-BY-4.0 (upstream data)",
    "source": {
      "dataset": "ARVO",
      "record": "42470801",
      "version": "v3.0.0"
    }
  },
  "status": "draft",
  "subject": {
    "fixed_in": "85a921f46184",
    "generation": "g0",
    "language": "c++",
    "project": "ffmpeg",
    "upstream": "https://git.ffmpeg.org/ffmpeg.git"
  },
  "title": "ffmpeg: Global-buffer-overflow READ 4 in ffmpeg_AV_CODEC_ID_LIBFDK_AAC_fuzzer",
  "vulnerability": {
    "class": "memory-safety",
    "crash_type": "Global-buffer-overflow READ 4",
    "cvss": null,
    "identifiers": {
      "cve": [],
      "cwe": [
        "CWE-119"
      ],
      "oss_fuzz": "42470801"
    },
    "sanitizer": "asan",
    "severity": "Medium"
  }
}
