{
  "abx_version": "0.1",
  "challenge": {
    "detector": {
      "match": "ERROR: AddressSanitizer",
      "type": "sanitizer-report"
    },
    "expect": {
      "fixed": "clean",
      "vulnerable": "crash"
    },
    "harness": "docker run --rm n132/arvo:42475836-vul arvo",
    "kind": "proof-of-vulnerability",
    "target": "encoder_heic_fuzzer"
  },
  "environments": {
    "fixed": {
      "ref": "n132/arvo:42475836-fix",
      "type": "oci-image"
    },
    "vulnerable": {
      "ref": "n132/arvo:42475836-vul",
      "type": "oci-image"
    }
  },
  "evidence": {
    "crash_digest": {
      "alg": "sha256",
      "value": "ac31f0bd54d1603c86f3dc534c581cf1089ef077d885efe0be7350f1cd89ba7e"
    },
    "crash_excerpt": "INFO: Seed: 847384600\nINFO: Loaded 1 modules (174288 inline 8-bit counters): 174288 [0x1f20cc0, 0x1f4b590),\nINFO: Loaded 1 PC tables (174288 PCs): 174288 [0x1f4b590,0x21f4290),\n/out/encoder_heic_fuzzer: Running 1 inputs 1 time(s) each.\nRunning: /tmp/poc\n=================================================================\n==7==ERROR: AddressSanitizer: stack-buffer-overflow on address 0x7ffff7f40e28 at pc 0x000000d3ef53 bp 0x7fffffffd960 sp 0x7fffffffd958\nREAD of size 8 at 0x7ffff7f40e28 thread T0\nSCARINESS: 38 ",
    "fix_commit": "cdddf99e151c9c2750af70e172d4b6dcb481e1b0",
    "patch": "https://github.com/imagemagick/imagemagick/commit/cdddf99e151c9c2750af70e172d4b6dcb481e1b0",
    "report": "https://issues.oss-fuzz.com/issues/42475836"
  },
  "id": "AB-000040",
  "integrity": {
    "algorithm": "sha256",
    "value": "1d0c5f89fe0a563900d7c01928b8bed074a50e162f518877bdf1121c5a1a8dd1"
  },
  "kind": "antibody",
  "provenance": {
    "generated_at": "2026-10-14T20:51:39+00:00",
    "generated_by": "germline-extractor/0.1",
    "license": "Apache-2.0 (document) / CC-BY-4.0 (upstream data)",
    "source": {
      "dataset": "ARVO",
      "record": "42475836",
      "version": "v3.0.0"
    }
  },
  "status": "draft",
  "subject": {
    "fixed_in": "cdddf99e151c",
    "generation": "g0",
    "language": "c++",
    "project": "imagemagick",
    "upstream": "https://github.com/imagemagick/imagemagick"
  },
  "title": "imagemagick: Stack-buffer-overflow READ 8 in encoder_heic_fuzzer",
  "vulnerability": {
    "class": "memory-safety",
    "crash_type": "Stack-buffer-overflow READ 8",
    "cvss": null,
    "identifiers": {
      "cve": [],
      "cwe": [
        "CWE-121"
      ],
      "oss_fuzz": "42475836"
    },
    "sanitizer": "asan",
    "severity": "Medium"
  }
}
