{
  "abx_version": "0.1",
  "challenge": {
    "detector": {
      "match": "ERROR: AddressSanitizer",
      "type": "sanitizer-report"
    },
    "expect": {
      "fixed": "clean",
      "vulnerable": "crash"
    },
    "harness": "docker run --rm n132/arvo:42470379-vul arvo",
    "kind": "proof-of-vulnerability",
    "target": "hb-shape-fuzzer"
  },
  "environments": {
    "fixed": {
      "ref": "n132/arvo:42470379-fix",
      "type": "oci-image"
    },
    "vulnerable": {
      "ref": "n132/arvo:42470379-vul",
      "type": "oci-image"
    }
  },
  "evidence": {
    "crash_digest": {
      "alg": "sha256",
      "value": "f331977939e9e3c630d7e1effc074d1152f91d990a034985fd1c56d591e817f5"
    },
    "crash_excerpt": "INFO: Seed: 327392543\nINFO: Loaded 1 modules (13341 inline 8-bit counters): 13341 [0xa2e3a8, 0xa317c5),\nINFO: Loaded 1 PC tables (13341 PCs): 13341 [0xa317c8,0xa65998),\n/out/hb-shape-fuzzer: Running 1 inputs 1 time(s) each.\nRunning: /tmp/poc\n=================================================================\n==7==ERROR: AddressSanitizer: heap-buffer-overflow on address 0x6110000003d8 at pc 0x0000005d2bec bp 0x7fffffffdc10 sp 0x7fffffffdc08\nREAD of size 1 at 0x6110000003d8 thread T0\nSCARINESS: 22 (1-byte-read-",
    "fix_commit": "67449c39331babb88f7d29d737895d786cd5da33",
    "patch": "https://github.com/harfbuzz/harfbuzz/commit/67449c39331babb88f7d29d737895d786cd5da33",
    "report": "https://issues.oss-fuzz.com/issues/42470379"
  },
  "id": "AB-000045",
  "integrity": {
    "algorithm": "sha256",
    "value": "fdd1425c0bc9e0459734e01bac70448e4bb62278355b7770cf8453781bf13c0c"
  },
  "kind": "antibody",
  "provenance": {
    "generated_at": "2026-10-14T20:51:39+00:00",
    "generated_by": "germline-extractor/0.1",
    "license": "Apache-2.0 (document) / CC-BY-4.0 (upstream data)",
    "source": {
      "dataset": "ARVO",
      "record": "42470379",
      "version": "v3.0.0"
    }
  },
  "status": "draft",
  "subject": {
    "fixed_in": "67449c39331b",
    "generation": "g0",
    "language": "c++",
    "project": "harfbuzz",
    "upstream": "https://github.com/harfbuzz/harfbuzz.git"
  },
  "title": "harfbuzz: Heap-buffer-overflow READ 1 in hb-shape-fuzzer",
  "vulnerability": {
    "class": "memory-safety",
    "crash_type": "Heap-buffer-overflow READ 1",
    "cvss": null,
    "identifiers": {
      "cve": [],
      "cwe": [
        "CWE-122"
      ],
      "oss_fuzz": "42470379"
    },
    "sanitizer": "asan",
    "severity": "Medium"
  }
}
