{
  "abx_version": "0.1",
  "challenge": {
    "detector": {
      "match": "ERROR: AddressSanitizer",
      "type": "sanitizer-report"
    },
    "expect": {
      "fixed": "clean",
      "vulnerable": "crash"
    },
    "harness": "docker run --rm n132/arvo:42474313-vul arvo",
    "kind": "proof-of-vulnerability",
    "target": "ping_dng_fuzzer"
  },
  "environments": {
    "fixed": {
      "ref": "n132/arvo:42474313-fix",
      "type": "oci-image"
    },
    "vulnerable": {
      "ref": "n132/arvo:42474313-vul",
      "type": "oci-image"
    }
  },
  "evidence": {
    "crash_digest": {
      "alg": "sha256",
      "value": "5d9b53a112bf41d24a77b731b30a3d8dead44acc1bdc23bfc02d29bf20e06f97"
    },
    "crash_excerpt": "INFO: Seed: 2211602858\nINFO: Loaded 1 modules (166583 inline 8-bit counters): 166583 [0x203cf28, 0x20659df),\nINFO: Loaded 1 PC tables (166583 PCs): 166583 [0x20659e0,0x22f0550),\n/out/ping_dng_fuzzer: Running 1 inputs 1 time(s) each.\nRunning: /tmp/poc\n=================================================================\n==7==ERROR: AddressSanitizer: heap-buffer-overflow on address 0x7ffff3f9dd82 at pc 0x0000014be76d bp 0x7fffffffcb80 sp 0x7fffffffcb78\nREAD of size 1 at 0x7ffff3f9dd82 thread T0\nSCARINESS: 22 (1-b",
    "fix_commit": "58b1d87bef2b8d7dbd7391091069a3c279ec5e85",
    "patch": "https://github.com/imagemagick/imagemagick/commit/58b1d87bef2b8d7dbd7391091069a3c279ec5e85",
    "report": "https://issues.oss-fuzz.com/issues/42474313"
  },
  "id": "AB-000039",
  "integrity": {
    "algorithm": "sha256",
    "value": "28bff4a3e0f46f4d7248c78b1185f1009a1c2279b0d770aa8bd0093617bdc0df"
  },
  "kind": "antibody",
  "provenance": {
    "generated_at": "2026-10-14T20:47:10+00:00",
    "generated_by": "germline-extractor/0.1",
    "license": "Apache-2.0 (document) / CC-BY-4.0 (upstream data)",
    "source": {
      "dataset": "ARVO",
      "record": "42474313",
      "version": "v3.0.0"
    }
  },
  "status": "draft",
  "subject": {
    "fixed_in": "58b1d87bef2b",
    "generation": "g0",
    "language": "c++",
    "project": "imagemagick",
    "upstream": "https://github.com/imagemagick/imagemagick"
  },
  "title": "imagemagick: Heap-buffer-overflow READ 1 in ping_dng_fuzzer",
  "vulnerability": {
    "class": "memory-safety",
    "crash_type": "Heap-buffer-overflow READ 1",
    "cvss": null,
    "identifiers": {
      "cve": [],
      "cwe": [
        "CWE-122"
      ],
      "oss_fuzz": "42474313"
    },
    "sanitizer": "asan",
    "severity": "Medium"
  }
}
