{
  "abx_version": "0.1",
  "challenge": {
    "detector": {
      "match": "ERROR: AddressSanitizer",
      "type": "sanitizer-report"
    },
    "expect": {
      "fixed": "clean",
      "vulnerable": "crash"
    },
    "harness": "docker run --rm n132/arvo:42470719-vul arvo",
    "kind": "proof-of-vulnerability",
    "target": "ffmpeg_AV_CODEC_ID_ILBC_fuzzer"
  },
  "environments": {
    "fixed": {
      "ref": "n132/arvo:42470719-fix",
      "type": "oci-image"
    },
    "vulnerable": {
      "ref": "n132/arvo:42470719-vul",
      "type": "oci-image"
    }
  },
  "evidence": {
    "crash_digest": {
      "alg": "sha256",
      "value": "eba9d45c0a286d14c13824035fd615107170a40795ec8d2ecdc93cd1fed264e5"
    },
    "crash_excerpt": "======================= INFO =========================\nThis binary is built for AFL-fuzz.\nTo run the target function on individual input(s) execute this:\n/out/ffmpeg_AV_CODEC_ID_ILBC_fuzzer < INPUT_FILE\nor\n/out/ffmpeg_AV_CODEC_ID_ILBC_fuzzer INPUT_FILE1 [INPUT_FILE2 ... ]\nTo fuzz with afl-fuzz execute this:\nafl-fuzz [afl-flags] /out/ffmpeg_AV_CODEC_ID_ILBC_fuzzer [-N]\nafl-fuzz will run N iterations before re-spawning the process (default: 1000)\n======================================================\nReading ",
    "fix_commit": "25eb10d941f35c3223300583588b1e13debc9288",
    "patch": "https://git.ffmpeg.org/gitweb/ffmpeg.git/commitdiff/25eb10d941f35c3223300583588b1e13debc9288",
    "report": "https://issues.oss-fuzz.com/issues/42470719"
  },
  "id": "AB-000017",
  "integrity": {
    "algorithm": "sha256",
    "value": "5cab88371c698b09a65051d9644649ffeafba07de3d2736e461b4b479469e0a4"
  },
  "kind": "antibody",
  "provenance": {
    "generated_at": "2026-10-14T20:51:39+00:00",
    "generated_by": "germline-extractor/0.1",
    "license": "Apache-2.0 (document) / CC-BY-4.0 (upstream data)",
    "source": {
      "dataset": "ARVO",
      "record": "42470719",
      "version": "v3.0.0"
    }
  },
  "status": "draft",
  "subject": {
    "fixed_in": "25eb10d941f3",
    "generation": "g0",
    "language": "c++",
    "project": "ffmpeg",
    "upstream": "https://git.ffmpeg.org/ffmpeg.git"
  },
  "title": "ffmpeg: Stack-buffer-underflow WRITE 2 in ffmpeg_AV_CODEC_ID_ILBC_fuzzer",
  "vulnerability": {
    "class": "memory-safety",
    "crash_type": "Stack-buffer-underflow WRITE 2",
    "cvss": null,
    "identifiers": {
      "cve": [],
      "cwe": [
        "CWE-124"
      ],
      "oss_fuzz": "42470719"
    },
    "sanitizer": "asan",
    "severity": "Medium"
  }
}
