{
  "abx_version": "0.1",
  "challenge": {
    "detector": {
      "match": "ERROR: AddressSanitizer",
      "type": "sanitizer-report"
    },
    "expect": {
      "fixed": "clean",
      "vulnerable": "crash"
    },
    "harness": "docker run --rm n132/arvo:42472424-vul arvo",
    "kind": "proof-of-vulnerability",
    "target": "ping_jps_fuzzer"
  },
  "environments": {
    "fixed": {
      "ref": "n132/arvo:42472424-fix",
      "type": "oci-image"
    },
    "vulnerable": {
      "ref": "n132/arvo:42472424-vul",
      "type": "oci-image"
    }
  },
  "evidence": {
    "crash_digest": {
      "alg": "sha256",
      "value": "49a7bd30901f6afcdeee70d54b0accee794c1d04a1595e7be95f2b4178743bf9"
    },
    "crash_excerpt": "INFO: Seed: 4249155029\nINFO: Loaded 1 modules (166509 inline 8-bit counters): 166509 [0x2039ce8, 0x2062755),\nINFO: Loaded 1 PC tables (166509 PCs): 166509 [0x2062758,0x22ece28),\n/out/ping_jps_fuzzer: Running 1 inputs 1 time(s) each.\nRunning: /tmp/poc\n=================================================================\n==7==ERROR: AddressSanitizer: heap-buffer-overflow on address 0x6140000001cf at pc 0x000000439adf bp 0x7ffd7b6d4190 sp 0x7ffd7b6d3940\nREAD of size 1 at 0x6140000001cf thread T0\nSCARINESS: 12 (1-b",
    "fix_commit": "9177b7b3c2789c6196e7272e97893d9f7d3991f2",
    "patch": "https://github.com/imagemagick/imagemagick/commit/9177b7b3c2789c6196e7272e97893d9f7d3991f2",
    "report": "https://issues.oss-fuzz.com/issues/42472424"
  },
  "id": "AB-000032",
  "integrity": {
    "algorithm": "sha256",
    "value": "ebe9a9f2b1cc4fb7a89cf457bda610909ffbd79d6436206eee274647b00e0f88"
  },
  "kind": "antibody",
  "provenance": {
    "generated_at": "2026-10-14T20:47:10+00:00",
    "generated_by": "germline-extractor/0.1",
    "license": "Apache-2.0 (document) / CC-BY-4.0 (upstream data)",
    "source": {
      "dataset": "ARVO",
      "record": "42472424",
      "version": "v3.0.0"
    }
  },
  "status": "draft",
  "subject": {
    "fixed_in": "9177b7b3c278",
    "generation": "g0",
    "language": "c++",
    "project": "imagemagick",
    "upstream": "https://github.com/imagemagick/imagemagick"
  },
  "title": "imagemagick: Heap-buffer-overflow READ 1 in ping_jps_fuzzer",
  "vulnerability": {
    "class": "memory-safety",
    "crash_type": "Heap-buffer-overflow READ 1",
    "cvss": null,
    "identifiers": {
      "cve": [],
      "cwe": [
        "CWE-122"
      ],
      "oss_fuzz": "42472424"
    },
    "sanitizer": "asan",
    "severity": "Medium"
  }
}
