{
  "abx_version": "0.1",
  "challenge": {
    "detector": {
      "match": "ERROR: AddressSanitizer",
      "type": "sanitizer-report"
    },
    "expect": {
      "fixed": "clean",
      "vulnerable": "crash"
    },
    "harness": "docker run --rm n132/arvo:42470093-vul arvo",
    "kind": "proof-of-vulnerability",
    "target": "hb-subset-fuzzer"
  },
  "environments": {
    "fixed": {
      "ref": "n132/arvo:42470093-fix",
      "type": "oci-image"
    },
    "vulnerable": {
      "ref": "n132/arvo:42470093-vul",
      "type": "oci-image"
    }
  },
  "evidence": {
    "crash_digest": {
      "alg": "sha256",
      "value": "3f146a00021ce46551583b5f973cfe13c4e98d5dbf357fe923fb6d868a338b5f"
    },
    "crash_excerpt": "======================= INFO =========================\nThis binary is built for AFL-fuzz.\nTo run the target function on individual input(s) execute this:\n/out/hb-subset-fuzzer < INPUT_FILE\nor\n/out/hb-subset-fuzzer INPUT_FILE1 [INPUT_FILE2 ... ]\nTo fuzz with afl-fuzz execute this:\nafl-fuzz [afl-flags] /out/hb-subset-fuzzer [-N]\nafl-fuzz will run N iterations before re-spawning the process (default: 1000)\n======================================================\nReading 2648 bytes from /tmp/poc\n=================",
    "fix_commit": "2dde6c803a9e50c5bff74095187b0cb2e12eebdd",
    "patch": "https://github.com/harfbuzz/harfbuzz/commit/2dde6c803a9e50c5bff74095187b0cb2e12eebdd",
    "report": "https://issues.oss-fuzz.com/issues/42470093"
  },
  "id": "AB-000041",
  "integrity": {
    "algorithm": "sha256",
    "value": "7a9a592582a683cbea69827065bddbaafdc121e53c20cfd0a4433379140f6007"
  },
  "kind": "antibody",
  "provenance": {
    "generated_at": "2026-10-14T20:47:10+00:00",
    "generated_by": "germline-extractor/0.1",
    "license": "Apache-2.0 (document) / CC-BY-4.0 (upstream data)",
    "source": {
      "dataset": "ARVO",
      "record": "42470093",
      "version": "v3.0.0"
    }
  },
  "status": "draft",
  "subject": {
    "fixed_in": "2dde6c803a9e",
    "generation": "g0",
    "language": "c++",
    "project": "harfbuzz",
    "upstream": "https://github.com/harfbuzz/harfbuzz.git"
  },
  "title": "harfbuzz: Heap-buffer-overflow READ 8 in hb-subset-fuzzer",
  "vulnerability": {
    "class": "memory-safety",
    "crash_type": "Heap-buffer-overflow READ 8",
    "cvss": null,
    "identifiers": {
      "cve": [],
      "cwe": [
        "CWE-122"
      ],
      "oss_fuzz": "42470093"
    },
    "sanitizer": "asan",
    "severity": "Medium"
  }
}
