{
  "abx_version": "0.1",
  "challenge": {
    "detector": {
      "match": "MemorySanitizer:DEADLYSIGNAL",
      "type": "sanitizer-report"
    },
    "expect": {
      "fixed": "clean",
      "vulnerable": "crash"
    },
    "harness": "docker run --rm n132/arvo:42472880-vul arvo",
    "kind": "proof-of-vulnerability",
    "target": "encoder_ept3_fuzzer"
  },
  "environments": {
    "fixed": {
      "ref": "n132/arvo:42472880-fix",
      "type": "oci-image"
    },
    "vulnerable": {
      "ref": "n132/arvo:42472880-vul",
      "type": "oci-image"
    }
  },
  "evidence": {
    "crash_digest": {
      "alg": "sha256",
      "value": "a329a43a0253b0b3c84fbc1fc9df0d60bd43a60b4a27c9a3ca8bcc790c34b57b"
    },
    "crash_excerpt": "INFO: Seed: 1334912712\nINFO: Loaded 1 modules (166528 inline 8-bit counters): 166528 [0x2bdfbd8, 0x2c08658),\nINFO: Loaded 1 PC tables (166528 PCs): 166528 [0x2c08658,0x2e92e58),\n/out/encoder_ept3_fuzzer: Running 1 inputs 1 time(s) each.\nRunning: /tmp/poc\nMemorySanitizer:DEADLYSIGNAL\n==7==ERROR: MemorySanitizer: SEGV on unknown address 0x7ffff70b248c (pc 0x7ffff6ef30b7 bp 0x7ffffffe6c60 sp 0x7ffffffe6c28 T7)\n==7==The signal is caused by a READ memory access.\n#0 0x7ffff6ef30b6 in __tolower_l (/lib/x86_64-linu",
    "fix_commit": "07eebcd72f45c8fd7563d3f9ec5d2bed48f65f36",
    "patch": "https://github.com/imagemagick/imagemagick/commit/07eebcd72f45c8fd7563d3f9ec5d2bed48f65f36",
    "report": "https://issues.oss-fuzz.com/issues/42472880"
  },
  "id": "AB-000034",
  "integrity": {
    "algorithm": "sha256",
    "value": "da927edb0231985f5ec6a78224f003a2acbecbcbd924d3fe2a9fe90cb2a7bf0d"
  },
  "kind": "antibody",
  "provenance": {
    "generated_at": "2026-10-14T20:47:10+00:00",
    "generated_by": "germline-extractor/0.1",
    "license": "Apache-2.0 (document) / CC-BY-4.0 (upstream data)",
    "source": {
      "dataset": "ARVO",
      "record": "42472880",
      "version": "v3.0.0"
    }
  },
  "status": "draft",
  "subject": {
    "fixed_in": "07eebcd72f45",
    "generation": "g0",
    "language": "c++",
    "project": "imagemagick",
    "upstream": "https://github.com/imagemagick/imagemagick"
  },
  "title": "imagemagick: UNKNOWN READ in encoder_ept3_fuzzer",
  "vulnerability": {
    "class": "memory-safety",
    "crash_type": "UNKNOWN READ",
    "cvss": null,
    "identifiers": {
      "cve": [],
      "cwe": [],
      "oss_fuzz": "42472880"
    },
    "sanitizer": "msan",
    "severity": "Medium"
  }
}
